{"version":"1.0","conclusion":{"text":"Expired sessions bypassed authentication validation.","status":"regression"},"signal":{"facts":["421 tests passed","5 authentication tests failed","HTTP expectation changed from 401 to 200"]},"visual":{"type":"graph","content":"middleware changed -> expiry validation removed -> expired session accepted -> auth tests failed"},"why":{"nodes":[{"id":"o1","type":"observation","text":"Expected 401, received 200","source":"tests/auth.spec.ts::rejects_expired_session"},{"id":"e1","type":"evidence","text":"Expired session is accepted","source":"tests/auth.spec.ts::rejects_expired_session"},{"id":"c1","type":"conclusion","text":"Authentication regression","source":null}],"edges":[{"from":"o1","to":"e1","relation":"supports"},{"from":"e1","to":"c1","relation":"supports"}]},"caveats":[],"confidence":{"level":"high","basis":"Regression test fails before the fix and passes after it."},"monitor":{"evidence":"tests/auth.spec.ts::rejects_expired_session — FAIL before fix, PASS after fix","guard":"CI must keep rejects_expired_session green","risk":"medium","state":"rewarded","next_budget_tokens":1600},"impact":{"source_tokens":575,"output_tokens":184,"budget_tokens":300,"presentation_reduction_pct":68.0,"co2e_equivalent_g":0.26,"estimate_quality":"low"}}
